{"schema_version":"frc-prediction/1","model_id":"fixture-model-v1","request_id":"prediction-9","snapshot_id":42,"epoch":7,"field":{"season":"OFFSEASON_2026","map_id":"synthetic-field-v1","geometry_revision":"geometry-v1"},"source":{"robot_boot_id":"robot-boot-1","localization_revision":"localization-v1","configuration_revision":"robot-config-v1"},"frame":"BLUE_FIELD","timestamp_domain":"ROBOT_MONOTONIC_US","history_cutoff_us":1000000,"valid_until_us":1400000,"horizon_us":200000,"step_us":100000,"sync":{"source_id":"robot-authority","mapping_revision":"direct-clock-v1","valid":true,"maximum_error_us":100},"issued_us":1010000,"history":[{"snapshot":{"id":41,"epoch":7,"obstacle_map_version":3,"field":{"season":"OFFSEASON_2026","map_id":"synthetic-field-v1","geometry_revision":"geometry-v1"},"ego":{"time_us":900000,"field_pose":{"position_m":{"x":1.0,"y":2.0},"heading_rad":0.0},"field_velocity":{"linear_mps":{"x":0.2,"y":0.0},"angular_radps":0.0},"uncertainty":{"xx_m2":0.01,"xy_m2":0.0,"yy_m2":0.01},"localization_valid":true},"tracks":[{"id":100,"epoch":7,"object_class":"piece","position_m":{"x":3.0,"y":2.0},"velocity_mps":{"x":0.0,"y":0.0},"estimate_us":900000,"last_measurement_us":870000,"confidence":0.9,"uncertainty":{"xx_m2":0.04,"xy_m2":0.0,"yy_m2":0.04},"lifecycle":"CONFIRMED","estimate_kind":"PROPAGATED","provenance":[{"source_id":"camera-front","boot_id":"camera-boot-1","calibration_revision":"calibration-v1","mount_revision":"mount-v1","correlation_group":"same-capture","sequence":41,"capture_us":870000,"publication_us":875000,"target_height_m":0.0}]}]},"valid_mask":true,"accepted_command":{"command_id":"drive-41","source_id":"robot-execution","authority":"ACCEPTED","frame":"ROBOT_RELATIVE","issued_us":898000,"accepted_us":899000,"body_twist":{"vx_mps":0.2,"vy_mps":0.0,"omega_radps":0.0},"mechanisms":[{"channel":"intake_enabled","unit":"bool","value":1.0}]}},{"snapshot":{"id":42,"epoch":7,"obstacle_map_version":3,"field":{"season":"OFFSEASON_2026","map_id":"synthetic-field-v1","geometry_revision":"geometry-v1"},"ego":{"time_us":1000000,"field_pose":{"position_m":{"x":1.0,"y":2.0},"heading_rad":0.0},"field_velocity":{"linear_mps":{"x":0.2,"y":0.0},"angular_radps":0.0},"uncertainty":{"xx_m2":0.01,"xy_m2":0.0,"yy_m2":0.01},"localization_valid":true},"tracks":[{"id":100,"epoch":7,"object_class":"piece","position_m":{"x":3.0,"y":2.0},"velocity_mps":{"x":0.0,"y":0.0},"estimate_us":1000000,"last_measurement_us":970000,"confidence":0.9,"uncertainty":{"xx_m2":0.04,"xy_m2":0.0,"yy_m2":0.04},"lifecycle":"CONFIRMED","estimate_kind":"PROPAGATED","provenance":[{"source_id":"camera-front","boot_id":"camera-boot-1","calibration_revision":"calibration-v1","mount_revision":"mount-v1","correlation_group":"same-capture","sequence":42,"capture_us":970000,"publication_us":975000,"target_height_m":0.0}]}]},"valid_mask":true,"accepted_command":{"command_id":"drive-42","source_id":"robot-execution","authority":"ACCEPTED","frame":"ROBOT_RELATIVE","issued_us":998000,"accepted_us":999000,"body_twist":{"vx_mps":0.2,"vy_mps":0.0,"omega_radps":0.0},"mechanisms":[{"channel":"intake_enabled","unit":"bool","value":1.0}]}}],"targets":[{"target_id":"ego","kind":"EGO","track_id":null},{"target_id":"piece-100","kind":"OBJECT_TRACK","track_id":100}],"candidates":[{"candidate_id":"hold","authority":"CANDIDATE","semantics":"BODY_TWIST_OPEN_LOOP_V1","frame":"ROBOT_RELATIVE","samples":[{"offset_us":0,"body_twist":{"vx_mps":0.0,"vy_mps":0.0,"omega_radps":0.0},"mechanisms":[{"channel":"intake_enabled","unit":"bool","value":1.0}]},{"offset_us":100000,"body_twist":{"vx_mps":0.0,"vy_mps":0.0,"omega_radps":0.0},"mechanisms":[{"channel":"intake_enabled","unit":"bool","value":1.0}]},{"offset_us":200000,"body_twist":{"vx_mps":0.0,"vy_mps":0.0,"omega_radps":0.0},"mechanisms":[{"channel":"intake_enabled","unit":"bool","value":1.0}]}]},{"candidate_id":"transit","authority":"CANDIDATE","semantics":"BODY_TWIST_OPEN_LOOP_V1","frame":"ROBOT_RELATIVE","samples":[{"offset_us":0,"body_twist":{"vx_mps":0.2,"vy_mps":0.0,"omega_radps":0.0},"mechanisms":[{"channel":"intake_enabled","unit":"bool","value":1.0}]},{"offset_us":100000,"body_twist":{"vx_mps":0.2,"vy_mps":0.0,"omega_radps":0.0},"mechanisms":[{"channel":"intake_enabled","unit":"bool","value":1.0}]},{"offset_us":200000,"body_twist":{"vx_mps":0.2,"vy_mps":0.0,"omega_radps":0.0},"mechanisms":[{"channel":"intake_enabled","unit":"bool","value":1.0}]}]}]}
